<?xml version="1.0" encoding="UTF-8"?>
<tns:staff xmlns:tns="http://www.example.com/staff"
	xmlns:xsi="http://www.w3.org/2001/XMLSchema-instance"
	xsi:schemaLocation="http://www.example.com/staff staff.xsd ">

	<tns:manager pass="aasd123123123" city="Berlin">
		<tns:firstName>Ivan</tns:firstName>
		<tns:id>n001</tns:id>
		<tns:secondName>Filimonau</tns:secondName>
		<tns:bonus>1500</tns:bonus>
	</tns:manager>

	<tns:manager pass="d123123444" city="Minsk">
		<tns:firstName>Sarah</tns:firstName>
		<tns:id>n002</tns:id>
		<tns:secondName>Connor</tns:secondName>
		<tns:bonus>3500</tns:bonus>
	</tns:manager>

	<tns:operator city="Minsk">
		<tns:firstName>John</tns:firstName>
		<tns:id>n003</tns:id>
		<tns:secondName>Connor</tns:secondName>
		<tns:numberOfTools>3</tns:numberOfTools>
	</tns:operator>



</tns:staff>
